### ISSUE TITLE
Dnsmasq: remove strict-order option

### ISSUE THREAD

**Issue by filippocarletti** [NethServer/dev#5705]
We used the *strict-order* dnsmasq option to mimic the resolver library behavior, i.e. to query the dns servers in the order they are found in the configuration page (it says primary and secondary).
Unfortunately, strict-order is broken (see http://lists.thekelleys.org.uk/pipermail/dnsmasq-discuss/2009q3/003295.html).

I propose to use *all-servers* to ask all servers in parallel, answering with the first response received.
This behavior is also implemented in musl (https://wiki.musl-libc.org/functional-differences-from-glibc.html#Name-Resolver/DNS), so I think we should not have problems.

Even in discouraged setup where the primary is an internal dns and the secondary a public dns for fallback we should retain the current implementation behavior because the internal dns should be the fastest.

**See also**

https://community.nethserver.org/t/how-to-disable-dnsmasq/11739/8

----

Thanks to Eliezer Croitoru (@elico)

**Comment by nethbot** [comment]
in `7.6.1810/testing`:
- nethserver-dnsmasq-1.6.7-1.1.g0b62d26.ns7.noarch.rpm [x86_64](http://packages.nethserver.org/nethserver/7.6.1810/testing/x86_64/Packages/nethserver-dnsmasq-1.6.7-1.1.g0b62d26.ns7.noarch.rpm) [armhfp](http://packages.nethserver.org/nethserver/7.6.1810/testing/armhfp/Packages/nethserver-dnsmasq-1.6.7-1.1.g0b62d26.ns7.noarch.rpm) [aarch64](http://packages.nethserver.org/nethserver/7.6.1810/testing/aarch64/Packages/nethserver-dnsmasq-1.6.7-1.1.g0b62d26.ns7.noarch.rpm)

**Comment by gsanchietti** [comment]
**Test case 1**
- Upgrade an existing machine
- Check the DNS behavior has no regressions

**Test case 2**
- Configure the upstream DNS with a working one and a broken one
- Check the dnsmasq is still functional

**Comment by filippocarletti** [comment]
Verified ok with:
1. two remote dns
2. one local and one remote dns
3. a working remote and a broken local

Pre upgrade:
```
16:57:16.309881 IP 192.168.5.17.27184 > 208.67.220.220.53: 19775+ A? ibm.com. (25)
16:57:16.326261 IP 208.67.220.220.53 > 192.168.5.17.27184: 19775 1/0/0 A 129.42.38.10 (41)
16:57:16.331530 IP 192.168.5.17.64876 > 208.67.220.220.53: 55274+ AAAA? ibm.com. (25)
16:57:16.451646 IP 208.67.220.220.53 > 192.168.5.17.64876: 55274 0/1/0 (85)
16:57:16.453229 IP 192.168.5.17.33577 > 208.67.220.220.53: 37624+ MX? ibm.com. (25)
16:57:16.469529 IP 208.67.220.220.53 > 192.168.5.17.33577: 37624 2/0/0 MX mx0b-001b2d01.pphosted.com. 5, MX mx0a-001b2d01.pphosted.com. 5 (94)

```

Post upgrade:

```
16:58:46.344052 IP 192.168.5.17.44974 > 208.67.220.220.53: 17655+ A? ibm.com. (25)
16:58:46.344125 IP 192.168.5.17.44974 > 208.67.222.222.53: 17655+ A? ibm.com. (25)
16:58:46.360933 IP 208.67.220.220.53 > 192.168.5.17.44974: 17655 1/0/0 A 129.42.38.10 (41)
16:58:46.362428 IP 208.67.222.222.53 > 192.168.5.17.44974: 17655 1/0/0 A 129.42.38.10 (41)
16:58:46.362772 IP 192.168.5.17.13581 > 208.67.220.220.53: 18906+ AAAA? ibm.com. (25)
16:58:46.362822 IP 192.168.5.17.13581 > 208.67.222.222.53: 18906+ AAAA? ibm.com. (25)
16:58:46.491881 IP 208.67.220.220.53 > 192.168.5.17.13581: 18906 0/1/0 (85)
16:58:46.493493 IP 192.168.5.17.33102 > 208.67.220.220.53: 64344+ MX? ibm.com. (25)
16:58:46.493588 IP 192.168.5.17.33102 > 208.67.222.222.53: 64344+ MX? ibm.com. (25)
16:58:46.494388 IP 208.67.222.222.53 > 192.168.5.17.13581: 18906 0/1/0 (85)
16:58:46.509869 IP 208.67.220.220.53 > 192.168.5.17.33102: 64344 2/0/0 MX mx0b-001b2d01.pphosted.com. 5, MX mx0a-001b2d01.pphosted.com. 5 (94)
16:58:46.510423 IP 208.67.222.222.53 > 192.168.5.17.33102: 64344 2/0/0 MX mx0b-001b2d01.pphosted.com. 5, MX mx0a-001b2d01.pphosted.com. 5 (94)

17:21:40.273884 IP 192.168.5.17.40925 > 208.67.222.222.53: 2959+ A? ibm.com. (25)
17:21:40.273948 IP 192.168.5.17.40925 > 192.168.5.252.53: 2959+ A? ibm.com. (25)
17:21:40.285004 IP 192.168.5.252.53 > 192.168.5.17.40925: 2959 1/0/0 A 129.42.38.10 (41)
17:21:40.286829 IP 192.168.5.17.49971 > 192.168.5.252.53: 27256+ AAAA? ibm.com. (25)
17:21:40.286885 IP 192.168.5.17.49971 > 208.67.222.222.53: 27256+ AAAA? ibm.com. (25)
17:21:40.292452 IP 208.67.222.222.53 > 192.168.5.17.40925: 2959 1/0/0 A 129.42.38.10 (41)
17:21:40.299406 IP 192.168.5.252.53 > 192.168.5.17.49971: 27256 0/1/0 (92)
17:21:40.300825 IP 192.168.5.17.52940 > 192.168.5.252.53: 59529+ MX? ibm.com. (25)
17:21:40.300880 IP 192.168.5.17.52940 > 208.67.222.222.53: 59529+ MX? ibm.com. (25)
17:21:40.305622 IP 208.67.222.222.53 > 192.168.5.17.49971: 27256 0/1/0 (85)
17:21:40.336883 IP 192.168.5.252.53 > 192.168.5.17.52940: 59529 2/0/0 MX mx0a-001b2d01.pphosted.com. 5, MX mx0b-001b2d01.pphosted.com. 5 (94)
17:21:40.422935 IP 208.67.222.222.53 > 192.168.5.17.52940: 59529 2/0/0 MX mx0b-001b2d01.pphosted.com. 5, MX mx0a-001b2d01.pphosted.com. 5 (94)

```

**Comment by nethbot** [comment]
in `7.6.1810/updates`:
- nethserver-dnsmasq-1.7.0-1.ns7.noarch.rpm [x86_64](http://packages.nethserver.org/nethserver/7.6.1810/updates/x86_64/Packages/nethserver-dnsmasq-1.7.0-1.ns7.noarch.rpm) [armhfp](http://packages.nethserver.org/nethserver/7.6.1810/updates/armhfp/Packages/nethserver-dnsmasq-1.7.0-1.ns7.noarch.rpm) [aarch64](http://packages.nethserver.org/nethserver/7.6.1810/updates/aarch64/Packages/nethserver-dnsmasq-1.7.0-1.ns7.noarch.rpm)
