### ISSUE TITLE
pihole-ftl rate limit

### ISSUE THREAD

**Issue by francio87** [NethServer/dev#6673]
After update `pihole-ftl` to version `5.14`, the default `RATE_LIMIT=1000/60` could cause DNS issue in the network.
If you have a machine that work as DNS server for all the client of the network it will reach the rate limit and all it's query get refused.

**Steps to reproduce**

Update pihole to version 5.14

**Expected behavior**

Everything works as usual

**Actual behavior**

After some minutes the client get it's DNS query refused :
```
12:03:05.780404 IP 208.67.220.220.53 > 192.168.200.3.50043: 53876 Refused 0/0/0 (45)
12:03:05.780412 IP 208.67.220.222.53 > 192.168.200.3.18442: 9866 Refused 0/0/0 (45)
12:03:05.780425 IP 208.67.220.220.53 > 192.168.200.3.18442: 9866 Refused 0/0/0 (45)
```

`pihole-FTL.log` :
```
[2022-06-10 11:46:25.123 692/T755] Still rate-limiting 192.168.200.3 as it made additional 11348 queries
[2022-06-10 11:47:25.164 692/T755] Still rate-limiting 192.168.200.3 as it made additional 11410 queries
[2022-06-10 11:48:25.210 692/T755] Still rate-limiting 192.168.200.3 as it made additional 11477 queries
```

**Workaround**

Setting the `RATE_LIMIT=0/0` disable the feature, this result in the same behavior as previous version

**Components**

pihole-ftl.x86_64 5.14-0.ns7

**See also**
- https://docs.pi-hole.net/ftldns/configfile/#rate_limit
> Rate-limiting may be disabled altogether by setting RATE_LIMIT=0/0 (this results in the same behavior as before FTL v5.7).

**Comment by gsanchietti** [comment]
**Test case**
- Check the bug is not reproducible
- To check if rate limit is disabled use: `grep RATE_LIMIT /var/log/messages`

**Comment by nethbot** [comment]
in `7.9.2009/testing`:
- nethserver-blacklist-1.2.6-1.1.g827f8b1.ns7.noarch.rpm [x86_64](http://packages.nethserver.org/nethserver/7.9.2009/testing/x86_64/Packages/nethserver-blacklist-1.2.6-1.1.g827f8b1.ns7.noarch.rpm) [armhfp](http://packages.nethserver.org/nethserver/7.9.2009/testing/armhfp/Packages/nethserver-blacklist-1.2.6-1.1.g827f8b1.ns7.noarch.rpm) [aarch64](http://packages.nethserver.org/nethserver/7.9.2009/testing/aarch64/Packages/nethserver-blacklist-1.2.6-1.1.g827f8b1.ns7.noarch.rpm)

**Comment by cotosso** [comment]
Bug is not reproducible:
Before the update:
```
Jun 23 12:56:10 vmtest pihole-ftl: [2022-06-23 12:56:10.723 22961M]    RATE_LIMIT: Rate-limiting client making more than 1000 queries in 60 seconds
```

after the update:
```
Jun 23 12:58:41 vmtest pihole-ftl: [2022-06-23 12:58:41.892 23990M]    RATE_LIMIT: Disabled
```

**Comment by nethbot** [comment]
in `7.9.2009/updates`:
- nethserver-blacklist-1.2.7-1.ns7.noarch.rpm [x86_64](http://packages.nethserver.org/nethserver/7.9.2009/updates/x86_64/Packages/nethserver-blacklist-1.2.7-1.ns7.noarch.rpm) [armhfp](http://packages.nethserver.org/nethserver/7.9.2009/updates/armhfp/Packages/nethserver-blacklist-1.2.7-1.ns7.noarch.rpm) [aarch64](http://packages.nethserver.org/nethserver/7.9.2009/updates/aarch64/Packages/nethserver-blacklist-1.2.7-1.ns7.noarch.rpm)
